option_name,Purchase price,Maintenance and reliability,Seating,Fuel efficiency,Versatility,Power,Safety
Electric SUV (e.g. Tesla Model Y),51000,8,5,123,8,384,9
Electric Sedan (e.g. Tesla Model 3),40000,8,5,132,6,283,9
Minivan (e.g. Toyota Sienna),39000,9,8,36,9,245,8
Compact sedan (e.g. Honda Civic),25000,9,4,36,5,158,8
SUV (e.g. Chevrolet Tahoe),60000,7,7,20,9,355,7
Pickup truck (e.g. Ford F-150),43000,6,5,22,10,400,8
Luxury sports car (e.g. Porsche 911),100000,9,2,30,10,550,9
Luxury SUV (e.g. Cadillac Escalade),120000,9,8,25,10,450,9